{
  "title": "ISRO to Launch AST BlueBird-2 Satellite",
  "source": "Sanskriti IAS",
  "metadata": {
    "prelims": "Space and Technology +CA",
    "mains": "GS 2 - International Relations; GS 3 - Space Technology, Science & Technology",
    "tags": ["ISRO", "Space Technology", "BlueBird Satellite", "LVM3", "International Relations"]
  },
  "content": [
    {
      "heading": "Why in News?",
      "subheading": null,
      "content": "The Indian Space Research Organisation (ISRO) will launch AST SpaceMobile's advanced BlueBird Block-2 satellite using its heavy-lift LVM3 rocket on December 24, 2025, from the Satish Dhawan Space Centre, Sriharikota, under a commercial agreement facilitated by NewSpace India Limited (NSIL)."
    },
    {
      "heading": "Background and Context",
      "subheading": null,
      "content": "India's space programme has progressively transitioned from being purely state-driven to a commercially competitive global launch service provider. With the creation of NSIL, ISRO's commercial arm, India has positioned itself as a reliable partner for international satellite operators.\n\nSimultaneously, global demand for space-based broadband and direct-to-smartphone connectivity has surged, driven by the need to bridge digital divides in remote and underserved regions. The LVM3-M6 mission reflects the convergence of these trends—India's heavy-lift launch capability and next-generation global telecom satellites."
    },
    {
      "heading": "About the LVM3-M6 Mission",
      "subheading": null,
      "content": "• Launch Vehicle: LVM3 (India's heavy-lift launch vehicle)\n• Mission Designation: LVM3-M6\n• Launch Date: December 24, 2025\n• Launch Site: Satish Dhawan Space Centre, Sriharikota\n• Commercial Facilitator: NewSpace India Limited (NSIL)\n\nThis mission marks another step in ISRO's expanding role in commercial satellite deployment for global clients."
    },
    {
      "heading": "About BlueBird Block-2 Satellite",
      "subheading": null,
      "content": "• Developed by AST SpaceMobile (USA)\n• Designed to deliver high-capacity space-based cellular broadband\n• Enables direct smartphone connectivity without reliance on ground-based cell towers\n• Operates in Low Earth Orbit (LEO)"
    },
    {
      "heading": "Key Technological Features",
      "subheading": null,
      "content": "• Equipped with a massive phased-array communications system (~2,400 square feet)\n• Among the largest commercial communications arrays deployed in LEO\n• Supports higher data throughput and continuous wide-area coverage"
    },
    {
      "heading": "Significance of the Mission",
      "subheading": "For India / ISRO",
      "content": "• Strengthens ISRO's credentials as a global commercial launch provider\n• Demonstrates the operational maturity of LVM3 for international commercial missions\n• Enhances NSIL's role in integrating India into the global space economy"
    },
    {
      "heading": "Significance of the Mission",
      "subheading": "For India–US Space Cooperation",
      "content": "• Reflects deepening Indo-US collaboration in advanced space technologies\n• Expands cooperation beyond government missions to commercial satellite ecosystems"
    },
    {
      "heading": "Significance of the Mission",
      "subheading": "For Global Connectivity",
      "content": "• Supports AST SpaceMobile's goal of universal cellular broadband coverage\n• Helps bridge connectivity gaps in remote, rural, and disaster-prone regions"
    },
    {
      "heading": "Significance of the Mission",
      "subheading": "Broader Implications",
      "content": "• Reinforces India's position in the LEO satellite launch market, alongside emerging global players\n• Aligns with India's vision of becoming a major space services hub under space sector reforms\n• Contributes to the global shift towards Direct-to-Device (D2D) satellite communication"
    }
  ],
  "faqs": [
    {
      "question": "What is special about the BlueBird Block-2 satellite?",
      "answer": "It enables high-speed cellular broadband directly to standard smartphones from space."
    },
    {
      "question": "Which Indian agency is handling the commercial launch?",
      "answer": "NewSpace India Limited (NSIL), ISRO's commercial arm."
    },
    {
      "question": "What is the role of LVM3 in this mission?",
      "answer": "LVM3 serves as the heavy-lift launch vehicle to deploy the BlueBird Block-2 satellite into orbit."
    },
    {
      "question": "How does AST SpaceMobile's technology differ from traditional telecom?",
      "answer": "It provides direct satellite-to-smartphone connectivity, eliminating the need for ground-based cell towers."
    },
    {
      "question": "Why is this mission important for India?",
      "answer": "It strengthens India's position as a global commercial space launch provider and showcases ISRO's capability to handle complex international missions."
    }
  ],
  "images": [
    {
      "url": "https://www.sanskritiias.com/uploaded_files/images/BlueBird_Block_2_Mission.jpg",
      "alt": "BlueBird Block 2 Mission illustration",
      "caption": "BlueBird_Block_2_Mission"
    }
  ],
  "extracted_at": "2025-12-25T18:00:04.865548"
}
